record_id,question,anchor,answerchoice_a,answerchoice_b,answerchoice_c,answerchoice_d,answerchoice_e,correct_answer,answer_explanation,age,subject
95A926AF,"A 3-year-old boy is brought to the pediatrician by his parents who are concerned about his eating habits. They report that he has a strong preference for milk and refuses to eat most solid foods. His parents also mention that he seems to tire easily and has been more irritable than usual. On physical examination, the child appears pale and has a smooth, red tongue.",What is the most likely diagnosis?,Iron deficiency anemia,Vitamin B12 deficiency,Folate deficiency,Vitamin D deficiency,Vitamin A deficiency,a,"This child's preference for milk, along with his symptoms of fatigue, irritability, and pallor, suggest iron deficiency anemia. Milk is a poor source of iron, and children who drink excessive amounts of milk and eat few solid foods can develop iron deficiency. The smooth, red tongue is a sign of glossitis, which can occur with iron deficiency.",3.0,16
54056CE6,A 6-year-old boy is brought to the pediatrician by his parents due to concerns about his behavior. His parents report that he has been having difficulty paying attention in school and is often forgetful in daily activities. He frequently loses his belongings and often fails to finish tasks. His teacher also reports that he often interrupts others and has difficulty waiting his turn. His symptoms have been present for the past year and are seen in more than one setting. His physical examination is unremarkable.,What is the most likely diagnosis?,Oppositional defiant disorder,Conduct disorder,Attention deficit hyperactivity disorder,Autism spectrum disorder,Anxiety disorder,c,"This child's symptoms of inattention, forgetfulness, impulsivity, and hyperactivity in more than one setting are consistent with a diagnosis of Attention Deficit Hyperactivity Disorder (ADHD). Oppositional defiant disorder is characterized by a pattern of angry/irritable mood, argumentative/defiant behavior, or vindictiveness. Conduct disorder involves a repetitive and persistent pattern of behavior in which the basic rights of others or major age-appropriate societal norms or rules are violated. Autism spectrum disorder is characterized by persistent deficits in social communication and interaction and restricted, repetitive patterns of behavior, interests, or activities. Anxiety disorders are characterized by excessive fear, anxiety, and related behavioral disturbances.",6.0,14
7D940F6B,A 2-year-old boy is brought to the pediatrician by his parents who are concerned about his recurrent episodes of abdominal pain and diarrhea. The parents report that the diarrhea is foul-smelling and greasy. The child has not gained weight for the past 6 months despite a good appetite. The physical examination reveals a distended abdomen and palpable fecal masses. Laboratory tests show a decreased serum concentration of fat-soluble vitamins.,What is the most likely diagnosis?,Celiac disease,Crohn's disease,Cystic fibrosis,Lactose intolerance,Gastroenteritis,c,"This child's symptoms of foul-smelling, greasy stools (steatorrhea), failure to thrive, and decreased serum concentration of fat-soluble vitamins are suggestive of malabsorption. The most common cause of pancreatic insufficiency in children is cystic fibrosis. Celiac disease typically presents with failure to thrive, diarrhea, and abdominal distention, but does not cause steatorrhea. Crohn's disease is less common in this age group and does not typically present with steatorrhea. Lactose intolerance and gastroenteritis would not cause a decrease in fat-soluble vitamins.",2.0,7
72F66DDA,"A 2-year-old boy is brought to the pediatrician by his parents for a routine check-up. His parents report that he has been healthy and has not had any illnesses. His immunizations are up to date, and he has been growing and developing normally. The pediatrician notes that the boy has not yet received the influenza vaccine for the current flu season.",What is the next best step in management?,Administer the influenza vaccine now,Wait until the boy is 3 years old to administer the influenza vaccine,Administer the influenza vaccine only if the boy has a chronic medical condition,Administer the influenza vaccine only if the boy's parents request it,Do not administer the influenza vaccine as it is not necessary for this age group,a,"The influenza vaccine is recommended annually for all individuals aged 6 months and older, including healthy children and adolescents. Therefore, the next best step in management for this boy is to administer the influenza vaccine now (choice A). Waiting until the boy is 3 years old (choice B), administering the vaccine only if he has a chronic medical condition (choice C), only if his parents request it (choice D), or not administering it at all (choice E) are all incorrect as they do not follow the recommended immunization schedule.",2.0,10
6072B257,"A 4-year-old boy is brought to the pediatrician by his mother who reports that he has been having difficulty urinating for the past two days. The mother also mentions that the boy has been complaining of abdominal pain and has a low-grade fever. On physical examination, the boy has a distended bladder and tenderness in the lower abdomen.",What is the most likely diagnosis?,Urinary tract infection,Acute pyelonephritis,Acute cystitis,Acute urinary retention,Bladder stones,d,"The boy's symptoms of difficulty urinating, abdominal pain, low-grade fever, and physical findings of a distended bladder and lower abdominal tenderness are indicative of acute urinary retention. This condition is often caused by an obstruction in the urinary tract, such as a urethral stricture or bladder neck obstruction, which prevents the bladder from emptying completely. The other options are less likely given the boy's symptoms and physical findings.",4.0,20
